{
  "schemaVersion": 1,
  "collectedAt": "2026-08-05T15:14:30Z",
  "number": 176,
  "author": "baedboibidex-cmyk",
  "authorAssociation": "CONTRIBUTOR",
  "state": "closed",
  "isDraft": false,
  "isMerged": true,
  "createdAt": "2026-07-25T00:11:46Z",
  "updatedAt": "2026-07-27T11:57:49Z",
  "closedAt": "2026-07-27T11:57:49Z",
  "mergedAt": "2026-07-27T11:57:49Z",
  "baseBranch": "main",
  "headBranch": "feat/lint-len-in-loop-condition",
  "baseSha": "17abd0e2f12dbd2edf74281895aef57d62a66ae4",
  "headSha": "6a3961d2414a338407b9b5e07420897a9c3d7934",
  "isFork": true,
  "headRepo": "baedboibidex-cmyk/soroban-cost-linter",
  "mergeableState": "unknown",
  "additions": 65,
  "deletions": 0,
  "changedFiles": 1,
  "reviews": [],
  "commits": [
    {
      "sha": "9abf099f1f01b2f0e4f9bba83539bbdcb1c501d1",
      "message": "feat: implement collection_len_in_loop_condition lint\n\nDetect len() calls on Soroban collection types (Vec, Map, Set) inside\nloops when the collection is not mutated. The lint suggests binding\nthe length before the loop to avoid repeated metered host calls.\n\nCloses #115",
      "isVerified": false,
      "authoredAt": "2026-07-25T00:10:37Z"
    },
    {
      "sha": "6a3961d2414a338407b9b5e07420897a9c3d7934",
      "message": "Merge branch 'main' into feat/lint-len-in-loop-condition",
      "isVerified": true,
      "authoredAt": "2026-07-27T11:56:51Z"
    }
  ],
  "files": [
    {
      "filename": "docs/lints/collection_len_in_loop_condition.md",
      "status": "added",
      "additions": 65,
      "deletions": 0
    }
  ],
  "comments": [
    {
      "id": 5075754523,
      "author": "drips-wave[bot]",
      "authorAssociation": "NONE",
      "body": "@baedboibidex-cmyk Great news! 🎉 Based on an automated assessment of this PR, the linked Wave issue(s) **no longer count against your application limits**.\n\nYou can now already apply to more issues while waiting for a review of this PR. Keep up the great work! 🚀\n\n[Learn more about application limits](https://docs.drips.network/wave/contributors/solving-issues-and-earning-rewards#application-limits)",
      "createdAt": "2026-07-25T00:11:55Z",
      "updatedAt": "2026-07-25T00:11:55Z"
    },
    {
      "id": 5077671359,
      "author": "mallison031",
      "authorAssociation": "MEMBER",
      "body": "Please fix your CL",
      "createdAt": "2026-07-25T08:18:32Z",
      "updatedAt": "2026-07-25T08:18:32Z"
    },
    {
      "id": 5079827695,
      "author": "wagmiiii",
      "authorAssociation": "MEMBER",
      "body": "Hello! 👋 \n\nWe recently optimized and simplified the CI workflows on the `main` branch. \n\nSince this PR is currently failing its CI checks, could you please **rebase your branch onto `main`**? This will pull in the new workflow configurations and might automatically resolve the CI failures. \n\nLet us know if you need any help with the rebase!",
      "createdAt": "2026-07-25T18:20:05Z",
      "updatedAt": "2026-07-25T18:20:05Z"
    },
    {
      "id": 5081182619,
      "author": "mallison031",
      "authorAssociation": "MEMBER",
      "body": "please sir resolve the conflicts and fix the cl\r\n",
      "createdAt": "2026-07-26T00:20:35Z",
      "updatedAt": "2026-07-26T00:20:35Z"
    }
  ],
  "checks": [
    {
      "name": "build-and-test",
      "status": "completed",
      "conclusion": "failure",
      "workflowRunId": "30263891724"
    }
  ],
  "baseChecks": [
    {
      "name": "build-and-test",
      "status": "completed",
      "conclusion": "failure",
      "workflowRunId": "30263785829"
    }
  ]
}
