{
  "schemaVersion": 1,
  "collectedAt": "2026-08-05T15:14:52Z",
  "number": 227,
  "author": "Olasunkanmi975",
  "authorAssociation": "CONTRIBUTOR",
  "state": "closed",
  "isDraft": false,
  "isMerged": true,
  "createdAt": "2026-07-25T21:51:41Z",
  "updatedAt": "2026-07-26T06:33:15Z",
  "closedAt": "2026-07-26T06:33:15Z",
  "mergedAt": "2026-07-26T06:33:15Z",
  "baseBranch": "main",
  "headBranch": "docs/write-a-guide-on-handling-false-positives",
  "baseSha": "33e39b010ce29368fac7374b476d42b1d8868880",
  "headSha": "3a842a1ad1fa61c7009214b66925376ba9843b5e",
  "isFork": true,
  "headRepo": "Olasunkanmi975/soroban-cost-linter",
  "mergeableState": "unknown",
  "additions": 143,
  "deletions": 0,
  "changedFiles": 3,
  "reviews": [],
  "commits": [
    {
      "sha": "19c1cd41a1970e8b3cdec188f2a37510a6b36dcd",
      "message": "docs: add guide on handling false positives\n\n- Create docs/false_positives.md covering:\n  - Definition and known false positive patterns per lint\n  - Three suppression methods: #[allow], .lintignore, budget.toml\n  - How to evaluate and report false positives\n  - Verification of suppression in tests\n- Update docs/SUMMARY.md with new guide entry\n- Update README.md suppression section to reference the guide\n- Add batch_write_different_keys test fixture demonstrating\n  realistic false-positive suppression scenario",
      "isVerified": false,
      "authoredAt": "2026-07-25T21:49:46Z"
    },
    {
      "sha": "93cefff1f60ebfeae97de3922562c196cbee05cc",
      "message": "fix: update stderr line numbers after adding batch_write_different_keys test fixture",
      "isVerified": false,
      "authoredAt": "2026-07-25T22:02:08Z"
    },
    {
      "sha": "3a842a1ad1fa61c7009214b66925376ba9843b5e",
      "message": "Merge branch 'main' into docs/write-a-guide-on-handling-false-positives",
      "isVerified": true,
      "authoredAt": "2026-07-26T06:29:37Z"
    }
  ],
  "files": [
    {
      "filename": "docs/SUMMARY.md",
      "status": "modified",
      "additions": 1,
      "deletions": 0
    },
    {
      "filename": "docs/false_positives.md",
      "status": "added",
      "additions": 134,
      "deletions": 0
    },
    {
      "filename": "soroban_cost_lints/ui/main.rs",
      "status": "modified",
      "additions": 8,
      "deletions": 0
    }
  ],
  "comments": [
    {
      "id": 5080723920,
      "author": "drips-wave[bot]",
      "authorAssociation": "NONE",
      "body": "@Olasunkanmi975 Great news! 🎉 Based on an automated assessment of this PR, the linked Wave issue(s) **no longer count against your application limits**.\n\nYou can now already apply to more issues while waiting for a review of this PR. Keep up the great work! 🚀\n\n[Learn more about application limits](https://docs.drips.network/wave/contributors/solving-issues-and-earning-rewards#application-limits)",
      "createdAt": "2026-07-25T21:51:47Z",
      "updatedAt": "2026-07-25T21:51:47Z"
    },
    {
      "id": 5081020072,
      "author": "wagmiiii",
      "authorAssociation": "MEMBER",
      "body": "@Olasunkanmi975 resolve conflicts",
      "createdAt": "2026-07-25T23:25:51Z",
      "updatedAt": "2026-07-25T23:25:51Z"
    }
  ],
  "checks": [
    {
      "name": "build-and-test",
      "status": "completed",
      "conclusion": "failure",
      "workflowRunId": "30191140721"
    }
  ],
  "baseChecks": [
    {
      "name": "build-and-test",
      "status": "completed",
      "conclusion": "failure",
      "workflowRunId": "30191229420"
    }
  ]
}
