{
  "schemaVersion": 1,
  "collectedAt": "2026-08-05T15:14:01Z",
  "number": 159,
  "author": "dependabot[bot]",
  "authorAssociation": "CONTRIBUTOR",
  "state": "closed",
  "isDraft": false,
  "isMerged": true,
  "createdAt": "2026-07-24T09:52:00Z",
  "updatedAt": "2026-07-25T11:25:00Z",
  "closedAt": "2026-07-25T11:24:52Z",
  "mergedAt": "2026-07-25T11:24:52Z",
  "baseBranch": "main",
  "headBranch": "dependabot/github_actions/github-actions-dependencies-640176b5ab",
  "baseSha": "0e43776a5db5b0c576d4c27e2d69aa0047a06326",
  "headSha": "3b6c1cb3420c4896a96bd8f6e0e4a5703112c60b",
  "isFork": false,
  "headRepo": "Tollcraft/soroban-cost-linter",
  "mergeableState": "unknown",
  "additions": 3,
  "deletions": 3,
  "changedFiles": 1,
  "reviews": [],
  "commits": [
    {
      "sha": "3b6c1cb3420c4896a96bd8f6e0e4a5703112c60b",
      "message": "chore(deps): bump actions/checkout\n\nBumps the github-actions-dependencies group with 1 update in the / directory: [actions/checkout](https://github.com/actions/checkout).\n\n\nUpdates `actions/checkout` from 4 to 7\n- [Release notes](https://github.com/actions/checkout/releases)\n- [Changelog](https://github.com/actions/checkout/blob/main/CHANGELOG.md)\n- [Commits](https://github.com/actions/checkout/compare/v4...v7)\n\n---\nupdated-dependencies:\n- dependency-name: actions/checkout\n  dependency-version: '7'\n  dependency-type: direct:production\n  update-type: version-update:semver-major\n  dependency-group: github-actions-dependencies\n...\n\nSigned-off-by: dependabot[bot] <support@github.com>",
      "isVerified": true,
      "authoredAt": "2026-07-24T22:02:50Z"
    }
  ],
  "files": [
    {
      "filename": ".github/workflows/lint.yml",
      "status": "modified",
      "additions": 3,
      "deletions": 3
    }
  ],
  "comments": [],
  "checks": [
    {
      "name": "lint",
      "status": "completed",
      "conclusion": "success",
      "workflowRunId": "30129739651"
    },
    {
      "name": "quality",
      "status": "completed",
      "conclusion": "success",
      "workflowRunId": "30129739651"
    },
    {
      "name": "validate-toolchain-pins",
      "status": "completed",
      "conclusion": "success",
      "workflowRunId": "30129739651"
    },
    {
      "name": "lint-matrix (nightly-2026-04-16)",
      "status": "completed",
      "conclusion": "success",
      "workflowRunId": "30129739651"
    },
    {
      "name": "Code Quality (nightly-2026-04-16)",
      "status": "completed",
      "conclusion": "success",
      "workflowRunId": "30129739651"
    }
  ],
  "baseChecks": [
    {
      "name": "lint",
      "status": "completed",
      "conclusion": "success",
      "workflowRunId": "30156188150"
    },
    {
      "name": "quality",
      "status": "completed",
      "conclusion": "success",
      "workflowRunId": "30156188150"
    },
    {
      "name": "Code Quality (nightly-2026-04-16)",
      "status": "completed",
      "conclusion": "success",
      "workflowRunId": "30156188150"
    },
    {
      "name": "lint-matrix (nightly-2026-04-16)",
      "status": "completed",
      "conclusion": "success",
      "workflowRunId": "30156188150"
    },
    {
      "name": "validate-toolchain-pins",
      "status": "completed",
      "conclusion": "success",
      "workflowRunId": "30156188150"
    }
  ]
}
