{
  "schemaVersion": 1,
  "collectedAt": "2026-08-05T15:14:21Z",
  "number": 169,
  "author": "DANTE-1903",
  "authorAssociation": "CONTRIBUTOR",
  "state": "closed",
  "isDraft": false,
  "isMerged": true,
  "createdAt": "2026-07-24T14:38:28Z",
  "updatedAt": "2026-07-24T22:38:50Z",
  "closedAt": "2026-07-24T22:38:50Z",
  "mergedAt": "2026-07-24T22:38:50Z",
  "baseBranch": "main",
  "headBranch": "test/dylib-load-smoke-test",
  "baseSha": "01196e61295a70155fa44a52c2fc8a8dc29b130f",
  "headSha": "e29c73659b1ec205ef1427e2f6f4618c9190e5ea",
  "isFork": true,
  "headRepo": "DANTE-1903/soroban-cost-linter",
  "mergeableState": "unknown",
  "additions": 18,
  "deletions": 0,
  "changedFiles": 3,
  "reviews": [
    {
      "author": "wagmiiii",
      "state": "APPROVED",
      "submittedAt": "2026-07-24T22:38:39Z"
    }
  ],
  "commits": [
    {
      "sha": "61a81b0b36f7eb584f55875005da9c15dd6c0916",
      "message": "test(ci): add dylib load smoke test under cargo-dylint",
      "isVerified": false,
      "authoredAt": "2026-07-24T14:32:04Z"
    },
    {
      "sha": "e27e8f0aac2af657c57bf9b87c11797f12cc6232",
      "message": "test(ci): fix smoke test to run from workspace root with --manifest-path",
      "isVerified": false,
      "authoredAt": "2026-07-24T14:47:18Z"
    },
    {
      "sha": "a09c8cbad1781ac5f51a9e5b886f35a0ecc1b4eb",
      "message": "test(ci): fix dylib path for smoke test",
      "isVerified": false,
      "authoredAt": "2026-07-24T14:55:51Z"
    },
    {
      "sha": "092bc0431f38f9e84f254ea6ebe91c0e3caf51b0",
      "message": "test(ci): run cargo dylint from fixture dir to find workspace library",
      "isVerified": false,
      "authoredAt": "2026-07-24T15:01:11Z"
    },
    {
      "sha": "ecc2b361e88ff38d4e26ccd3cfff65a42942c0e0",
      "message": "test(ci): run from workspace root with manifest-path",
      "isVerified": false,
      "authoredAt": "2026-07-24T15:06:41Z"
    },
    {
      "sha": "71c6d6d350866a8d40cf76999d37c9c3d04e7db6",
      "message": "test(ci): add smoke_test fixture to workspace for cargo-dylint discovery",
      "isVerified": false,
      "authoredAt": "2026-07-24T15:18:23Z"
    },
    {
      "sha": "17a5b429b01f7b654089801be76a71ee7b5edd67",
      "message": "test(ci): run cargo dylint from fixture dir as workspace member",
      "isVerified": false,
      "authoredAt": "2026-07-24T15:27:38Z"
    },
    {
      "sha": "0294d8fbc2d053da479aaf2f308e73e9d8a8d914",
      "message": "Merge branch 'main' into test/dylib-load-smoke-test",
      "isVerified": true,
      "authoredAt": "2026-07-24T15:49:54Z"
    },
    {
      "sha": "32319a28170997d64c566ef40f4a8808c674133b",
      "message": "Merge branch 'main' into test/dylib-load-smoke-test",
      "isVerified": true,
      "authoredAt": "2026-07-24T18:57:58Z"
    },
    {
      "sha": "81764ee92c9cdc742c237675c965eee4d691c445",
      "message": "Merge branch 'main' into test/dylib-load-smoke-test",
      "isVerified": true,
      "authoredAt": "2026-07-24T22:01:37Z"
    },
    {
      "sha": "e29c73659b1ec205ef1427e2f6f4618c9190e5ea",
      "message": "Merge branch 'main' into test/dylib-load-smoke-test",
      "isVerified": true,
      "authoredAt": "2026-07-24T22:12:10Z"
    }
  ],
  "files": [
    {
      "filename": "test_fixtures/smoke_test/Cargo.toml",
      "status": "added",
      "additions": 8,
      "deletions": 0
    },
    {
      "filename": "test_fixtures/smoke_test/budget.toml",
      "status": "added",
      "additions": 2,
      "deletions": 0
    },
    {
      "filename": "test_fixtures/smoke_test/src/lib.rs",
      "status": "added",
      "additions": 8,
      "deletions": 0
    }
  ],
  "comments": [
    {
      "id": 5071058312,
      "author": "drips-wave[bot]",
      "authorAssociation": "NONE",
      "body": "@DANTE-1903 Great news! 🎉 Based on an automated assessment of this PR, the linked Wave issue(s) **no longer count against your application limits**.\n\nYou can now already apply to more issues while waiting for a review of this PR. Keep up the great work! 🚀\n\n[Learn more about application limits](https://docs.drips.network/wave/contributors/solving-issues-and-earning-rewards#application-limits)",
      "createdAt": "2026-07-24T14:38:40Z",
      "updatedAt": "2026-07-24T14:38:40Z"
    }
  ],
  "checks": [
    {
      "name": "lint",
      "status": "completed",
      "conclusion": "success",
      "workflowRunId": "30130232061"
    },
    {
      "name": "quality",
      "status": "completed",
      "conclusion": "success",
      "workflowRunId": "30130232061"
    },
    {
      "name": "validate-toolchain-pins",
      "status": "completed",
      "conclusion": "success",
      "workflowRunId": "30130232061"
    },
    {
      "name": "Code Quality (nightly-2026-04-16)",
      "status": "completed",
      "conclusion": "success",
      "workflowRunId": "30130232061"
    },
    {
      "name": "lint-matrix (nightly-2026-04-16)",
      "status": "completed",
      "conclusion": "success",
      "workflowRunId": "30130232061"
    }
  ],
  "baseChecks": [
    {
      "name": "lint",
      "status": "completed",
      "conclusion": "success",
      "workflowRunId": "30130201951"
    },
    {
      "name": "quality",
      "status": "completed",
      "conclusion": "success",
      "workflowRunId": "30130201951"
    },
    {
      "name": "validate-toolchain-pins",
      "status": "completed",
      "conclusion": "success",
      "workflowRunId": "30130201951"
    },
    {
      "name": "lint-matrix (nightly-2026-04-16)",
      "status": "completed",
      "conclusion": "success",
      "workflowRunId": "30130201951"
    },
    {
      "name": "Code Quality (nightly-2026-04-16)",
      "status": "completed",
      "conclusion": "success",
      "workflowRunId": "30130201951"
    }
  ]
}
